{
  "topic": "Adaptive orchestration switching in LLM multi-agent systems: dynamically selecting between orchestration patterns based on task characteristics at runtime",
  "search_queries": [
    "adaptive multi-agent orchestration LLM",
    "dynamic agent topology switching",
    "meta-orchestration multi-agent systems",
    "LLM agent workflow optimization cost",
    "task complexity routing multi-agent",
    "agent coordination pattern selection",
    "LLM cascade routing adaptive",
    "multi-agent system reconfiguration runtime",
    "FrugalGPT LLM routing cost optimization",
    "RouteLLM model routing selection",
    "multi-agent LLM framework survey",
    "LLM agent cost quality tradeoff",
    "dynamic workflow agent pipeline",
    "hierarchical multi-agent planning LLM",
    "LLM mixture of agents debate",
    "agent swarm collective intelligence LLM",
    "task decomposition multi-agent allocation",
    "autonomous agent orchestration framework",
    "cost-aware LLM routing model selection",
    "mixture of agents LLM ensemble",
    "all:adaptive AND all:orchestration AND all:multi-agent AND all:LLM",
    "all:dynamic AND all:agent AND all:topology AND all:LLM",
    "all:LLM AND all:routing AND all:cost AND all:optimization",
    "all:FrugalGPT OR all:RouteLLM",
    "all:multi-agent AND all:workflow AND all:optimization AND all:language",
    "all:hierarchical AND all:multi-agent AND all:planning AND all:LLM",
    "all:mixture AND all:agents AND all:LLM",
    "all:task AND all:decomposition AND all:agent AND all:orchestration",
    "key_paper: AdaptOrch",
    "key_paper: CASTER",
    "key_paper: AFlow",
    "key_paper: G-Designer",
    "key_paper: MasRouter",
    "key_paper: xRouter",
    "key_paper: Multi-Agent Collaboration via Evolving Orchestration",
    "key_paper: Topological Structure Learning"
  ],
  "papers": [
    {
      "id": "SS-53132ea6c107479d4557631299d3ed525109b464",
      "title": "AFlow: Automating Agentic Workflow Generation",
      "authors": [
        "Jiayi Zhang",
        "Jinyu Xiang",
        "Zhaoyang Yu",
        "Fengwei Teng",
        "Xiong-hui Chen",
        "Jiaqi Chen",
        "Mingchen Zhuge",
        "Xin Cheng",
        "Sirui Hong",
        "Jinlin Wang"
      ],
      "year": 2024,
      "venue": "International Conference on Learning Representations",
      "doi": "10.48550/arXiv.2410.10762",
      "arxiv_id": "2410.10762",
      "semantic_scholar_id": "53132ea6c107479d4557631299d3ed525109b464",
      "openalex_id": null,
      "abstract": "Large language models (LLMs) have demonstrated remarkable potential in solving complex tasks across diverse domains, typically by employing agentic workflows that follow detailed instructions and operational sequences. However, constructing these workflows requires significant human effort, limiting scalability and generalizability. Recent research has sought to automate the generation and optimization of these workflows, but existing methods still rely on initial manual setup and fall short of ",
      "contribution": "Reformulates agentic workflow optimization as search over code-represented workflows using Monte Carlo Tree Search, achieving 5.7% average improvement over SOTA. ICLR 2025 Oral.",
      "limitation": "MCTS search is computationally expensive; discovered workflows may overfit to specific benchmark distributions.",
      "relevance_score": 6.5,
      "citations_count": 167,
      "references": [],
      "cited_by": [],
      "cluster": "workflow-optimization",
      "retrieval_source": "semantic_scholar",
      "peer_reviewed": true
    },
    {
      "id": "SS-36e8d3e3c93cf70eb15cb21adb92f38068e3360a",
      "title": "Aragog: Just-in-Time Model Routing for Scalable Serving of Agentic Workflows",
      "authors": [
        "Yinwei Dai",
        "Zhuofu Chen",
        "Anand Iyer",
        "Ravi Netravali"
      ],
      "year": 2025,
      "venue": "arXiv.org",
      "doi": "10.48550/arXiv.2511.20975",
      "arxiv_id": "2511.20975",
      "semantic_scholar_id": "36e8d3e3c93cf70eb15cb21adb92f38068e3360a",
      "openalex_id": null,
      "abstract": "Agentic workflows have emerged as a powerful paradigm for solving complex, multi-stage tasks, but serving them at scale is computationally expensive given the many LLM inferences that each request must pass through. Configuration selection, or the cost-aware assignment of workflow agents to specific LLMs, can reduce these costs, but existing approaches bind configuration decisions before request execution, making them ill-suited for the heterogeneous and lengthy execution of workflows. Specifica",
      "contribution": "Proposes just-in-time model routing for serving agentic workflows at scale, dynamically allocating compute resources based on workflow stage requirements.",
      "limitation": "System-level optimization focus; does not address the higher-level question of which orchestration pattern to use.",
      "relevance_score": 6.5,
      "citations_count": 0,
      "references": [],
      "cited_by": [],
      "cluster": "llm-routing-cascading",
      "retrieval_source": "semantic_scholar",
      "peer_reviewed": false
    },
    {
      "id": "SS-d6fe8458ae8874d7a17ae3f4c3338192415409f4",
      "title": "Trust by Design: Skill Profiles for Transparent, Cost-Aware LLM Routing",
      "authors": [
        "Mika Okamoto",
        "Ansel Kaplan Erol",
        "Glenn Scott Matlin"
      ],
      "year": 2026,
      "venue": "arXiv.org",
      "doi": "10.48550/arXiv.2602.02386",
      "arxiv_id": "2602.02386",
      "semantic_scholar_id": "d6fe8458ae8874d7a17ae3f4c3338192415409f4",
      "openalex_id": null,
      "abstract": "How should Large Language Model (LLM) practitioners select the right model for a task without wasting money? We introduce BELLA (Budget-Efficient LLM Selection via Automated skill-profiling), a framework that recommends optimal LLM selection for tasks through interpretable skill-based model selection. Standard benchmarks report aggregate metrics that obscure which specific capabilities a task requires and whether a cheaper model could suffice. BELLA addresses this gap through three stages: (1) d",
      "contribution": "Introduces skill profiles for transparent LLM routing, enabling cost-aware selection based on explicitly modeled model capabilities per task type.",
      "limitation": "Skill profiles require careful manual or automated construction; may not capture emergent model capabilities.",
      "relevance_score": 6.5,
      "citations_count": 0,
      "references": [],
      "cited_by": [],
      "cluster": "llm-routing-cascading",
      "retrieval_source": "semantic_scholar",
      "peer_reviewed": false
    },
    {
      "id": "SS-43c5bf1f874b5c02c654629b1bf0269830256d6e",
      "title": "AdaptOrch: Task-Adaptive Multi-Agent Orchestration in the Era of LLM Performance Convergence",
      "authors": [
        "Ge Yu"
      ],
      "year": 2026,
      "venue": "arXiv preprint",
      "doi": null,
      "arxiv_id": "2602.16873",
      "semantic_scholar_id": "43c5bf1f874b5c02c654629b1bf0269830256d6e",
      "openalex_id": null,
      "abstract": "As large language models from diverse providers converge toward comparable benchmark performance, the traditional paradigm of selecting a single best model per task yields diminishing returns. We argue that orchestration topology -- the structural composition of how multiple agents are coordinated, parallelized, and synthesized -- now dominates system-level performance over individual model capability. We present AdaptOrch, a formal framework for task-adaptive multi-agent orchestration that dyna",
      "contribution": "Formalizes task-adaptive multi-agent orchestration with a framework that dynamically selects among four canonical topologies (parallel, sequential, hierarchical, hybrid) based on task dependency graphs, demonstrating that orchestration topology dominates performance over individual model capability.",
      "limitation": "Evaluation limited to a fixed set of four topology patterns; does not explore continuous topology spaces or mixed/hybrid patterns within a single task execution.",
      "relevance_score": 6.0,
      "citations_count": 1,
      "references": [],
      "cited_by": [],
      "cluster": "adaptive-orchestration-switching",
      "retrieval_source": "semantic_scholar",
      "peer_reviewed": false
    },
    {
      "id": "SS-6805515d30840c94e0c2a232b1a7321b59032f1e",
      "title": "Difficulty-Aware Agentic Orchestration for Query-Specific Multi-Agent Workflows",
      "authors": [
        "Jinwei Su",
        "Qizhen Lan",
        "Yinghui Xia",
        "Lifan Sun",
        "Weiyou Tian",
        "Tianyu Shi",
        "Xinyuan Song",
        "Lewei He",
        "JingSong Yang"
      ],
      "year": 2025,
      "venue": "arXiv preprint",
      "doi": null,
      "arxiv_id": "2509.11079",
      "semantic_scholar_id": "6805515d30840c94e0c2a232b1a7321b59032f1e",
      "openalex_id": null,
      "abstract": "Large Language Model (LLM)-based agentic systems have shown strong capabilities across various tasks. However, existing multi-agent frameworks often rely on static or task-level workflows, which either over-process simple queries or underperform on complex ones, while also neglecting the efficiency-performance trade-offs across heterogeneous LLMs. To address these limitations, we propose Difficulty-Aware Agentic Orchestration (DAAO), which can dynamically generate query-specific multi-agent work",
      "contribution": "Presents DAAO, a dynamic framework adapting workflow depth, operator selection, and LLM assignment based on query difficulty, using a VAE for difficulty estimation combined with cost-performance-aware LLM routing.",
      "limitation": "Difficulty estimation via VAE adds latency overhead; assumes difficulty is estimable from the query alone without task execution feedback.",
      "relevance_score": 6.0,
      "citations_count": 2,